key,en,de
global_targets:3-2-title,"By 2030, end preventable deaths of newborns and children under 5 years of age, with all countries aiming to reduce neonatal mortality to at least as low as 12 per 1,000 live births and under‐5 mortality to at least as low as 25 per 1,000 live births","Bis 2030 den vermeidbaren Todesfällen bei Neugeborenen und Kindern unter 5 Jahren ein Ende setzen, mit dem von allen Ländern zu verfolgenden Ziel, die Sterblichkeit bei Neugeborenen mindestens auf 12 je 1.000 Lebendgeburten und bei Kindern unter 5 Jahren mindestens auf 25 je 1.000 Lebendgeburten zu senken"
global_targets:3-3-title,"By 2030, end the epidemics of AIDS, tuberculosis, malaria and neglected tropical diseases and combat hepatitis, water-borne diseases and other communicable diseases","Bis 2030 die Aids-, Tuberkulose- und Malariaepidemien und die vernachlässigten Tropenkrankheiten beseitigen und Hepatitis, durch Wasser übertragene Krankheiten und andere übertragbare Krankheiten bekämpfen"
global_targets:3-4-title,"By 2030, reduce by one third premature mortality from non-communicable diseases through prevention and treatment and promote mental health and well-being",Bis 2030 die Frühsterblichkeit aufgrund von nichtübertragbaren Krankheiten durch Prävention und Behandlung um ein Drittel senken und die psychische Gesundheit und das Wohlergehen fördern
global_targets:3-5-title,"Strengthen the prevention and treatment of substance abuse, including narcotic drug abuse and harmful use of alcohol","Die Prävention und Behandlung des Substanzmissbrauchs, namentlich des Suchtstoffmissbrauchs und des schädlichen Gebrauchs von Alkohol, verstärken"
global_targets:3-6-title,"By 2020, halve the number of global deaths and injuries from road traffic accidents",Bis 2020 die Zahl der Todesfälle und Verletzungen infolge von Verkehrsunfällen weltweit halbieren
global_targets:3-7-title,"By 2030, ensure universal access to sexual and reproductive health-care services, including for family planning, information and education, and the integration of reproductive health into national strategies and programmes","Bis 2030 den allgemeinen Zugang zu sexual- und reproduktionsmedizinischer Versorgung, einschließlich Familienplanung, Information und Aufklärung, und die Einbeziehung der reproduktiven Gesundheit in nationale Strategien und Programme gewährleisten"
global_targets:3-8-title,"Achieve universal health coverage, including financial risk protection, access to quality essential health-care services and access to safe, effective, quality and affordable essential medicines and vaccines for all","Die allgemeine Gesundheitsversorgung, einschließlich der Absicherung gegen finanzielle Risiken, den Zugang zu hochwertigen grundlegenden Gesundheitsdiensten und den Zugang zu sicheren, wirksamen, hochwertigen und bezahlbaren unentbehrlichen Arzneimitteln und Impfstoffen für alle erreichen"
global_targets:3-9-title,"By 2030, substantially reduce the number of deaths and illnesses from hazardous chemicals and air, water and soil pollution and contamination","Bis 2030 die Zahl der Todesfälle und Erkrankungen aufgrund gefährlicher Chemikalien und der Verschmutzung und Verunreinigung von Luft, Wasser und Boden erheblich verringern"
global_targets:3-a-title,"Strengthen the implementation of the World Health Organization Framework Convention on Tobacco Control in all countries, as appropriate",Die Durchführung des Rahmenübereinkommens der Weltgesundheitsorganisation zur Eindämmung des Tabakgebrauchs in allen Ländern nach Bedarf stärken
global_targets:3-b-title,"Support the research and development of vaccines and medicines for the communicable and non‐communicable diseases that primarily affect developing countries, provide access to affordable essential medicines and vaccines, in accordance with the Doha Declaration on the TRIPS Agreement and Public Health, which affirms the right of developing countries to use to the full the provisions in the Agreement on Trade-Related Aspects of Intellectual Property Rights regarding flexibilities to protect public health, and, in particular, provide access to medicines for all","Forschung und Entwicklung zu Impfstoffen und Medikamenten für übertragbare und nichtübertragbare Krankheiten, von denen hauptsächlich Entwicklungsländer betroffen sind, unterstützen, den Zugang zu bezahlbaren unentbehrlichen Arzneimitteln und Impfstoffen gewährleisten, im Einklang mit der Erklärung von Doha über das TRIPS-Übereinkommen und die öffentliche Gesundheit, die das Recht der Entwicklungsländer bekräftigt, die Bestimmungen in dem Übereinkommen über handelsbezogene Aspekte der Rechte des geistigen Eigentums über Flexibilitäten zum Schutz der öffentlichen Gesundheit voll auszuschöpfen, und insbesondere den Zugang zu Medikamenten für alle zu gewährleisten"
global_targets:3-c-title,"Substantially increase health financing and the recruitment, development, training and retention of the health workforce in developing countries, especially in least developed countries and small island developing States","Die Gesundheitsfinanzierung und die Rekrutierung, Aus- und Weiterbildung und Bindung von Gesundheitsfachkräften in den Entwicklungsländern und insbesondere in den am wenigsten entwickelten Ländern und den kleinen Inselentwicklungsländern deutlich erhöhen"
global_targets:3-d-title,"Strengthen the capacity of all countries, in particular developing countries, for early warning, risk reduction and management of national and global health risks","Die Kapazitäten aller Länder, insbesondere der Entwicklungsländer, in den Bereichen Frühwarnung, Risikominderung und Management nationaler und globaler Gesundheitsrisiken stärken"
global_targets:4-1-title,"By 2030, ensure that all girls and boys complete free, equitable and quality primary and secondary education leading to relevant and effective learning outcomes","Bis 2030 sicherstellen, dass alle Mädchen und Jungen gleichberechtigt eine kostenlose und hochwertige Grund- und Sekundarschulbildung abschließen, die zu brauchbaren und effektiven Lernergebnissen führt"
global_targets:4-2-title,"By 2030, ensure that all girls and boys have access to quality early childhood development, care and pre‐primary education so that they are ready for primary education","Bis 2030 sicherstellen, dass alle Mädchen und Jungen Zugang zu hochwertiger frühkindlicher Erziehung, Betreuung und Vorschulbildung erhalten, damit sie auf die Grundschule vorbereitet sind"
global_targets:4-3-title,"By 2030, ensure equal access for all women and men to affordable and quality technical, vocational and tertiary education, including university","Bis 2030 den gleichberechtigten Zugang aller Frauen und Männer zu einer erschwinglichen und hochwertigen fachlichen, beruflichen und tertiären Bildung einschließlich universitärer Bildung gewährleisten"
global_targets:4-4-title,"By 2030, substantially increase the number of youth and adults who have relevant skills, including technical and vocational skills, for employment, decent jobs and entrepreneurship","Bis 2030 die Zahl der Jugendlichen und Erwachsenen wesentlich erhöhen, die über die entsprechenden Qualifikationen einschließlich fachlicher und beruflicher Qualifikationen für eine Beschäftigung, eine menschenwürdige Arbeit und Unternehmertum verfügen"
global_targets:4-5-title,"By 2030, eliminate gender disparities in education and ensure equal access to all levels of education and vocational training for the vulnerable, including persons with disabilities, indigenous peoples and children in vulnerable situations","Bis 2030 geschlechtsspezifische Disparitäten in der Bildung beseitigen und den gleichberechtigen Zugang der Schwachen in der Gesellschaft, namentlich von Menschen mit Behinderungen, Angehörigen indigener Völker und Kindern in prekären Situationen, zu allen Bildungs- und Ausbildungsebenen gewährleisten"
global_targets:4-6-title,"By 2030, ensure that all youth and a substantial proportion of adults, both men and women, achieve literacy and numeracy","Bis 2030 sicherstellen, dass alle Jugendlichen und ein erheblicher Anteil der männlichen und weiblichen Erwachsenen lesen, schreiben und rechnen lernen"
global_targets:4-7-title,"By 2030, ensure that all learners acquire the knowledge and skills needed to promote sustainable development, including, among others, through education for sustainable development and sustainable lifestyles, human rights, gender equality, promotion of a culture of peace and non-violence, global citizenship and appreciation of cultural diversity and of culture’s contribution to sustainable development","Bis 2030 sicherstellen, dass alle Lernenden die notwendigen Kenntnisse und Qualifikationen zur Förderung nachhaltiger Entwicklung erwerben, unter anderem durch Bildung für nachhaltige Entwicklung und nachhaltige Lebensweisen, Menschenrechte, Geschlechtergleichstellung, eine Kultur des Friedens und der Gewaltlosigkeit, Weltbürgerschaft und die Wertschätzung kultureller Vielfalt und des Beitrags der Kultur zu nachhaltiger Entwicklung"
global_targets:4-a-title,"Build and upgrade education facilities that are child, disability and gender sensitive and provide safe, non-violent, inclusive and effective learning environments for all","Bildungseinrichtungen bauen und ausbauen, die kinder-, behinderten- und geschlechtergerecht sind und eine sichere, gewaltfreie, inklusive und effektive Lernumgebung für alle bieten"
global_targets:4-b-title,"By 2020, substantially expand globally the number of scholarships available to developing countries, in particular least developed countries, small island developing States and African countries, for enrolment in higher education, including vocational training and information and communications technology, technical, engineering and scientific programmes, in developed countries and other developing countries","Bis 2020 weltweit die Zahl der verfügbaren Stipendien für Entwicklungsländer, insbesondere für die am wenigsten entwickelten Länder, die kleinen Inselentwicklungsländer und die afrikanischen Länder, zum Besuch einer Hochschule, einschließlich zur Berufsbildung und zu Informations- und Kommunikationstechnik-, Technik-, Ingenieurs- und Wissenschaftsprogrammen, in entwickelten Ländern und in anderen Entwicklungsländern wesentlich erhöhen"
global_targets:4-c-title,"By 2030, substantially increase the supply of qualified teachers, including through international cooperation for teacher training in developing countries, especially least developed countries and small island developing States",Bis 2030 das Angebot an qualifizierten Lehrkräften unter anderem durch internationale Zusammenarbeit im Bereich der Lehrerausbildung in den Entwicklungsländern und insbesondere in den am wenigsten entwickelten Ländern und kleinen Inselentwicklungsländern wesentlich erhöhen
global_targets:5-1-title,End all forms of discrimination against all women and girls everywhere,Alle Formen der Diskriminierung von Frauen und Mädchen überall auf der Welt beenden
global_targets:5-2-title,"Eliminate all forms of violence against all women and girls in the public and private spheres, including trafficking and sexual and other types of exploitation",Alle Formen von Gewalt gegen alle Frauen und Mädchen im öffentlichen und im privaten Bereich einschließlich des Menschenhandels und sexueller und anderer Formen der Ausbeutung beseitigen
global_targets:5-3-title,"Eliminate all harmful practices, such as child, early and forced marriage and female genital mutilation","Alle schädlichen Praktiken wie Kinderheirat, Frühverheiratung und Zwangsheirat sowie die Genitalverstümmelung bei Frauen und Mädchen beseitigen"
global_targets:5-4-title,"Recognize and value unpaid care and domestic work through the provision of public services, infrastructure and social protection policies and the promotion of shared responsibility within the household and the family as nationally appropriate","Unbezahlte Pflege- und Hausarbeit durch die Bereitstellung öffentlicher Dienstleistungen und Infrastrukturen, Sozialschutzmaßnahmen und die Förderung geteilter Verantwortung innerhalb des Haushalts und der Familie entsprechend den nationalen Gegebenheiten anerkennen und wertschätzen"
global_targets:5-5-title,"Ensure women’s full and effective participation and equal opportunities for leadership at all levels of decision-making in political, economic and public life","Die volle und wirksame Teilhabe von Frauen und ihre Chancengleichheit bei der Übernahme von Führungsrollen auf allen Ebenen der Entscheidungsfindung im politischen, wirtschaftlichen und öffentlichen Leben sicherstellen"
global_targets:5-6-title,Ensure universal access to sexual and reproductive health and reproductive rights as agreed in accordance with the Programme of Action of the International Conference on Population and Development and the Beijing Platform for Action and the outcome documents of their review conferences,"Den allgemeinen Zugang zu sexueller und reproduktiver Gesundheit und reproduktiven Rechten gewährleisten, wie im Einklang mit dem Aktionsprogramm der Internationalen Konferenz über Bevölkerung und Entwicklung, der Aktionsplattform von Beijing und den Ergebnisdokumenten ihrer Überprüfungskonferenzen vereinbart"
global_targets:5-a-title,"Undertake reforms to give women equal rights to economic resources, as well as access to ownership and control over land and other forms of property, financial services, inheritance and natural resources, in accordance with national laws","Reformen durchführen, um Frauen die gleichen Rechte auf wirtschaftliche Ressourcen sowie Zugang zu Grundeigentum und zur Verfügungsgewalt über Grund und Boden und sonstige Vermögensformen, zu Finanzdienstleistungen, Erbschaften und natürlichen Ressourcen zu verschaffen, im Einklang mit den nationalen Rechtsvorschriften"
global_targets:5-b-title,"Enhance the use of enabling technology, in particular information and communications technology, to promote the empowerment of women","Die Nutzung von Grundlagentechnologien, insbesondere der Informations- und Kommunikationstechnologien, verbessern, um die Selbstbestimmung der Frauen zu fördern"
global_targets:5-c-title,Adopt and strengthen sound policies and enforceable legislation for the promotion of gender equality and the empowerment of all women and girls at all levels,Eine solide Politik und durchsetzbare Rechtsvorschriften zur Förderung der Gleichstellung der Geschlechter und der Selbstbestimmung aller Frauen und Mädchen auf allen Ebenen beschließen und verstärken
global_targets:6-1-title,"By 2030, achieve universal and equitable access to safe and affordable drinking water for all",Bis 2030 den allgemeinen und gerechten Zugang zu einwandfreiem und bezahlbarem Trinkwasser für alle erreichen
global_targets:6-2-title,"By 2030, achieve access to adequate and equitable sanitation and hygiene for all and end open defecation, paying special attention to the needs of women and girls and those in vulnerable situations","Bis 2030 den Zugang zu einer angemessenen und gerechten Sanitärversorgung und Hygiene für alle erreichen und der Notdurftverrichtung im Freien ein Ende setzen, unter besonderer Beachtung der Bedürfnisse von Frauen und Mädchen und von Menschen in prekären Situationen"
global_targets:6-3-title,"By 2030, improve water quality by reducing pollution, eliminating dumping and minimizing release of hazardous chemicals and materials, halving the proportion of untreated wastewater and substantially increasing recycling and safe reuse globally","Bis 2030 die Wasserqualität durch Verringerung der Verschmutzung, Beendigung des Einbringens und Minimierung der Freisetzung gefährlicher Chemikalien und Stoffe, Halbierung des Anteils unbehandelten Abwassers und eine beträchtliche Steigerung der Wiederaufbereitung und gefahrlosen Wiederverwendung weltweit verbessern"
global_targets:6-4-title,"By 2030, substantially increase water-use efficiency across all sectors and ensure sustainable withdrawals and supply of freshwater to address water scarcity and substantially reduce the number of people suffering from water scarcity","Bis 2030 die Effizienz der Wassernutzung in allen Sektoren wesentlich steigern und eine nachhaltige Entnahme und Bereitstellung von Süßwasser gewährleisten, um der Wasserknappheit zu begegnen und die Zahl der unter Wasserknappheit leidenden Menschen erheblich zu verringern"
global_targets:6-5-title,"By 2030, implement integrated water resources management at all levels, including through transboundary cooperation as appropriate","Bis 2030 auf allen Ebenen eine integrierte Bewirtschaftung der Wasserressourcen umsetzen, gegebenenfalls auch mittels grenzüberschreitender Zusammenarbeit"
global_targets:6-6-title,"By 2020, protect and restore water-related ecosystems, including mountains, forests, wetlands, rivers, aquifers and lakes","Bis 2020 wasserverbundene Ökosysteme schützen und wiederherstellen, darunter Berge, Wälder, Feuchtgebiete, Flüsse, Grundwasserleiter und Seen"
global_targets:6-a-title,"By 2030, expand international cooperation and capacity-building support to developing countries in water- and sanitation-related activities and programmes, including water harvesting, desalination, water efficiency, wastewater treatment, recycling and reuse technologies","Bis 2030 die internationale Zusammenarbeit und die Unterstützung der Entwicklungsländer beim Kapazitätsaufbau für Aktivitäten und Programme im Bereich der Wasser- und Sanitärversorgung ausbauen, einschließlich der Wassersammlung und -speicherung, Entsalzung, effizienten Wassernutzung, Abwasserbehandlung, Wiederaufbereitungs- und Wiederverwendungstechnologien"
global_targets:6-b-title,Support and strengthen the participation of local communities in improving water and sanitation management,Die Mitwirkung lokaler Gemeinwesen an der Verbesserung der Wasserbewirtschaftung und der Sanitärversorgung unterstützen und verstärken
global_targets:7-1-title,"By 2030, ensure universal access to affordable, reliable and modern energy services","Bis 2030 den allgemeinen Zugang zu bezahlbaren, verlässlichen und modernen Energiedienstleistungen sichern"
global_targets:7-2-title,"By 2030, increase substantially the share of renewable energy in the global energy mix",Bis 2030 den Anteil erneuerbarer Energie am globalen Energiemix deutlich erhöhen
global_targets:7-3-title,"By 2030, double the global rate of improvement in energy efficiency",Bis 2030 die weltweite Steigerungsrate der Energieeffizienz verdoppeln
global_targets:7-a-title,"By 2030, enhance international cooperation to facilitate access to clean energy research and technology, including renewable energy, energy efficiency and advanced and cleaner fossil-fuel technology, and promote investment in energy infrastructure and clean energy technology","Bis 2030 die internationale Zusammenarbeit verstärken, um den Zugang zur Forschung und Technologie im Bereich saubere Energie, namentlich erneuerbare Energie, Energieeffizienz sowie fortschrittliche und saubere Technologien für fossile Brennstoffe, zu erleichtern, und Investitionen in die Energieinfrastruktur und saubere Energietechnologien fördern"
global_targets:7-b-title,"By 2030, expand infrastructure and upgrade technology for supplying modern and sustainable energy services for all in developing countries, in particular least developed countries, small island developing States and landlocked developing countries, in accordance with their respective programmes of support","Bis 2030 die Infrastruktur ausbauen und die Technologie modernisieren, um in den Entwicklungsländern und insbesondere in den am wenigsten entwickelten Ländern, den kleinen Inselentwicklungsländern und den Binnenentwicklungsländern im Einklang mit ihren jeweiligen Unterstützungsprogrammen moderne und nachhaltige Energiedienstleistungen für alle bereitzustellen"
global_targets:8-1-title,"Sustain per capita economic growth in accordance with national circumstances and, in particular, at least 7 per cent gross domestic product growth per annum in the least developed countries",Ein Pro-Kopf-Wirtschaftswachstum entsprechend den nationalen Gegebenheiten und insbesondere ein jährliches Wachstum des Bruttoinlandsprodukts von mindestens 7 Prozent in den am wenigsten entwickelten Ländern aufrechterhalten
global_targets:8-10-title,"Strengthen the capacity of domestic financial institutions to encourage and expand access to banking, insurance and financial services for all","Die Kapazitäten der nationalen Finanzinstitutionen stärken, um den Zugang zu Bank-, Versicherungs- und Finanzdienstleistungen für alle zu begünstigen und zu erweitern"
global_targets:8-2-title,"Achieve higher levels of economic productivity through diversification, technological upgrading and innovation, including through a focus on high-value added and labour-intensive sectors","Eine höhere wirtschaftliche Produktivität durch Diversifizierung, technologische Modernisierung und Innovation erreichen, einschließlich durch Konzentration auf mit hoher Wertschöpfung verbundene und arbeitsintensive Sektoren"
global_targets:8-3-title,"Promote development-oriented policies that support productive activities, decent job creation, entrepreneurship, creativity and innovation, and encourage the formalization and growth of micro-, small- and medium-sized enterprises, including through access to financial services","Entwicklungsorientierte Politiken fördern, die produktive Tätigkeiten, die Schaffung menschenwürdiger Arbeitsplätze, Unternehmertum, Kreativität und Innovation unterstützen, und die Formalisierung und das Wachstum von Kleinst-, Klein- und Mittelunternehmen unter anderem durch den Zugang zu Finanzdienstleistungen begünstigen"
global_targets:8-4-title,"Improve progressively, through 2030, global resource efficiency in consumption and production and endeavour to decouple economic growth from environmental degradation, in accordance with the 10‐Year Framework of Programmes on Sustainable Consumption and Production, with developed countries taking the lead","Bis 2030 die weltweite Ressourceneffizienz in Konsum und Produktion Schritt für Schritt verbessern und die Entkopplung von Wirtschaftswachstum und Umweltzerstörung anstreben, im Einklang mit dem Zehnjahres-Programmrahmen für nachhaltige Konsum- und Produktionsmuster, wobei die entwickelten Länder die Führung übernehmen"
global_targets:8-5-title,"By 2030, achieve full and productive employment and decent work for all women and men, including for young people and persons with disabilities, and equal pay for work of equal value","Bis 2030 produktive Vollbeschäftigung und menschenwürdige Arbeit für alle Frauen und Männer, einschließlich junger Menschen und Menschen mit Behinderungen, sowie gleiches Entgelt für gleichwertige Arbeit erreichen"
global_targets:8-6-title,"By 2020, substantially reduce the proportion of youth not in employment, education or training","Bis 2020 den Anteil junger Menschen, die ohne Beschäftigung sind und keine Schul- oder Berufsausbildung durchlaufen, erheblich verringern"
global_targets:8-7-title,"Take immediate and effective measures to eradicate forced labour, end modern slavery and human trafficking and secure the prohibition and elimination of the worst forms of child labour, including recruitment and use of child soldiers, and by 2025 end child labour in all its forms","Sofortige und wirksame Maßnahmen ergreifen, um Zwangsarbeit abzuschaffen, moderne Sklaverei und Menschenhandel zu beenden und das Verbot und die Beseitigung der schlimmsten Formen der Kinderarbeit, einschließlich der Einziehung und des Einsatzes von Kindersoldaten, sicherstellen und bis 2025 jeder Form von Kinderarbeit ein Ende setzen"
global_targets:8-8-title,"Protect labour rights and promote safe and secure working environments for all workers, including migrant workers, in particular women migrants, and those in precarious employment","Die Arbeitsrechte schützen und sichere Arbeitsumgebungen für alle Arbeitnehmer, einschließlich der Wanderarbeitnehmer, insbesondere der Wanderarbeitnehmerinnen, und der Menschen in prekären Beschäftigungsverhältnissen, fördern"
global_targets:8-9-title,"By 2030, devise and implement policies to promote sustainable tourism that creates jobs and promotes local culture and products","Bis 2030 Politiken zur Förderung eines nachhaltigen Tourismus erarbeiten und umsetzen, der Arbeitsplätze schafft und die lokale Kultur und lokale Produkte fördert"
global_targets:8-a-title,"Increase Aid for Trade support for developing countries, in particular least developed countries, including through the Enhanced Integrated Framework for Trade-related Technical Assistance to Least Developed Countries","Die im Rahmen der Handelshilfe gewährte Unterstützung für die Entwicklungsländer und insbesondere die am wenigsten entwickelten Länder erhöhen, unter anderem durch den Erweiterten integrierten Rahmenplan für handelsbezogene technische Hilfe für die am wenigsten entwickelten Länder"
global_targets:8-b-title,"By 2020, develop and operationalize a global strategy for youth employment and implement the Global Jobs Pact of the International Labour Organization",Bis 2020 eine globale Strategie für Jugendbeschäftigung erarbeiten und auf den Weg bringen und den Globalen Beschäftigungspakt der Internationalen Arbeitsorganisation umsetzen
