key,en,de
global_targets:1-1-title,Target TEST,"Bis 2030 die extreme Armut - gegenwärtig definiert als der Anteil der Menschen, die mit weniger als 1,25 Dollar pro Tag auskommen müssen - für alle Menschen überall auf der Welt beseitigen"
global_targets:1-2-title,"By 2030, reduce at least by half the proportion of men, women and children of all ages living in poverty in all its dimensions according to national definitions","Bis 2030 den Anteil der Männer, Frauen und Kinder jeden Alters, die in Armut in all ihren Dimensionen nach der jeweiligen nationalen Definition leben, mindestens um die Hälfte senken"
global_targets:1-3-title,"Implement nationally appropriate social protection systems and measures for all, including floors, and by 2030 achieve substantial coverage of the poor and the vulnerable","Den nationalen Gegebenheiten entsprechende Sozialschutzsysteme und -maßnahmen für alle umsetzen, einschließlich eines Basisschutzes, und bis 2030 eine breite Versorgung der Armen und Schwachen erreichen"
global_targets:1-4-title,"By 2030, ensure that all men and women, in particular the poor and the vulnerable, have equal rights to economic resources, as well as access to basic services, ownership and control over land and other forms of property, inheritance, natural resources, appropriate new technology and financial services, including microfinance","Bis 2030 sicherstellen, dass alle Männer und Frauen, insbesondere die Armen und Schwachen, die gleichen Rechte auf wirtschaftliche Ressourcen sowie Zugang zu grundlegenden Diensten, Grundeigentum und Verfügungsgewalt über Grund und Boden und sonstigen Vermögensformen, Erbschaften, natürlichen Ressourcen, geeigneten neuen Technologien und Finanzdienstleistungen einschließlich Mikrofinanzierung haben"
global_targets:1-5-title,"By 2030, build the resilience of the poor and those in vulnerable situations and reduce their exposure and vulnerability to climate-related extreme events and other economic, social and environmental shocks and disasters","Bis 2030 die Widerstandsfähigkeit der Armen und der Menschen in prekären Situationen erhöhen und ihre Exposition und Anfälligkeit gegenüber klimabedingten Extremereignissen und anderen wirtschaftlichen, sozialen und ökologischen Schocks und Katastrophen verringern"
global_targets:1-a-title,"Ensure significant mobilization of resources from a variety of sources, including through enhanced development cooperation, in order to provide adequate and predictable means for developing countries, in particular least developed countries, to implement programmes and policies to end poverty in all its dimensions","Eine erhebliche Mobilisierung von Ressourcen aus einer Vielzahl von Quellen gewährleisten, einschließlich durch verbesserte Entwicklungszusammenarbeit, um den Entwicklungsländern und insbesondere den am wenigsten entwickelten Ländern ausreichende und berechenbare Mittel für die Umsetzung von Programmen und Politiken zur Beendigung der Armut in all ihren Dimensionen bereitzustellen"
global_targets:1-b-title,"Create sound policy frameworks at the national, regional and international levels, based on pro-poor and gender-sensitive development strategies, to support accelerated investment in poverty eradication actions","Auf nationaler, regionaler und internationaler Ebene solide politische Rahmen auf der Grundlage armutsorientierter und geschlechtersensibler Entwicklungsstrategien schaffen, um beschleunigte Investitionen in Maßnahmen zur Beseitigung der Armut zu unterstützen"
global_targets:10-1-title,"By 2030, progressively achieve and sustain income growth of the bottom 40 per cent of the population at a rate higher than the national average",Bis 2030 nach und nach ein über dem nationalen Durchschnitt liegendes Einkommenswachstum der ärmsten 40 Prozent der Bevölkerung erreichen und aufrechterhalten
global_targets:10-2-title,"By 2030, empower and promote the social, economic and political inclusion of all, irrespective of age, sex, disability, race, ethnicity, origin, religion or economic or other status","Bis 2030 alle Menschen unabhängig von Alter, Geschlecht, Behinderung, Rasse, Ethnizität, Herkunft, Religion oder wirtschaftlichem oder sonstigem Status zu Selbstbestimmung befähigen und ihre soziale, wirtschaftliche und politische Inklusion fördern"
global_targets:10-3-title,"Ensure equal opportunity and reduce inequalities of outcome, including by eliminating discriminatory laws, policies and practices and promoting appropriate legislation, policies and action in this regard","Chancengleichheit gewährleisten und Ungleichheit der Ergebnisse reduzieren, namentlich durch die Abschaffung diskriminierender Gesetze, Politiken und Praktiken und die Förderung geeigneter gesetzgeberischer, politischer und sonstiger Maßnahmen in dieser Hinsicht"
global_targets:10-4-title,"Adopt policies, especially fiscal, wage and social protection policies, and progressively achieve greater equality","Politische Maßnahmen beschließen, insbesondere fiskalische, lohnpolitische und den Sozialschutz betreffende Maßnahmen, und schrittweise größere Gleichheit erzielen"
global_targets:10-5-title,Improve the regulation and monitoring of global financial markets and institutions and strengthen the implementation of such regulations,Die Regulierung und Überwachung der globalen Finanzmärkte und -institutionen verbessern und die Anwendung der einschlägigen Vorschriften verstärken
global_targets:10-6-title,"Ensure enhanced representation and voice for developing countries in decision-making in global international economic and financial institutions in order to deliver more effective, credible, accountable and legitimate institutions","Eine bessere Vertretung und verstärkte Mitsprache der Entwicklungsländer bei der Entscheidungsfindung in den globalen internationalen Wirtschafts- und Finanzinstitutionen sicherstellen, um die Wirksamkeit, Glaubwürdigkeit, Rechenschaftslegung und Legitimation dieser Institutionen zu erhöhen"
global_targets:10-7-title,"Facilitate orderly, safe, regular and responsible migration and mobility of people, including through the implementation of planned and well-managed migration policies","Eine geordnete, sichere, reguläre und verantwortungsvolle Migration und Mobilität von Menschen erleichtern, unter anderem durch die Anwendung einer planvollen und gut gesteuerten Migrationspolitik"
global_targets:10-a-title,"Implement the principle of special and differential treatment for developing countries, in particular least developed countries, in accordance with World Trade Organization agreements","Den Grundsatz der besonderen und differenzierten Behandlung der Entwicklungsländer, insbesondere der am wenigsten entwickelten Länder, im Einklang mit den Übereinkünften der Welthandelsorganisation anwenden"
global_targets:10-b-title,"Encourage official development assistance and financial flows, including foreign direct investment, to States where the need is greatest, in particular least developed countries, African countries, small island developing States and landlocked developing countries, in accordance with their national plans and programmes","Öffentliche Entwicklungshilfe und Finanzströme einschließlich ausländischer Direktinvestitionen in die Staaten fördern, in denen der Bedarf am größten ist, insbesondere in die am wenigsten entwickelten Länder, die afrikanischen Länder, die kleinen Inselentwicklungsländer und die Binnenentwicklungsländer, im Einklang mit ihren jeweiligen nationalen Plänen und Programmen"
global_targets:10-c-title,"By 2030, reduce to less than 3 per cent the transaction costs of migrant remittances and eliminate remittance corridors with costs higher than 5 per cent",Bis 2030 die Transaktionskosten für Heimatüberweisungen von Migranten auf weniger als 3 Prozent senken und Überweisungskorridore mit Kosten von über 5 Prozent beseitigen
global_targets:11-1-title,"By 2030, ensure access for all to adequate, safe and affordable housing and basic services and upgrade slums","Bis 2030 den Zugang zu angemessenem, sicherem und bezahlbarem Wohnraum und zur Grundversorgung für alle sicherstellen und Slums sanieren"
global_targets:11-2-title,"By 2030, provide access to safe, affordable, accessible and sustainable transport systems for all, improving road safety, notably by expanding public transport, with special attention to the needs of those in vulnerable situations, women, children, persons with disabilities and older persons","Bis 2030 den Zugang zu sicheren, bezahlbaren, zugänglichen und nachhaltigen Verkehrssystemen für alle ermöglichen und die Sicherheit im Straßenverkehr verbessern, insbesondere durch den Ausbau des öffentlichen Verkehrs, mit besonderem Augenmerk auf den Bedürfnissen von Menschen in prekären Situationen, Frauen, Kindern, Menschen mit Behinderungen und älteren Menschen"
global_targets:11-3-title,"By 2030, enhance inclusive and sustainable urbanization and capacity for participatory, integrated and sustainable human settlement planning and management in all countries","Bis 2030 die Verstädterung inklusiver und nachhaltiger gestalten und die Kapazitäten für eine partizipatorische, integrierte und nachhaltige Siedlungsplanung und -steuerung in allen Ländern verstärken"
global_targets:11-4-title,Strengthen efforts to protect and safeguard the world’s cultural and natural heritage,Die Anstrengungen zum Schutz und zur Wahrung des Weltkultur- und -naturerbes verstärken
global_targets:11-5-title,"By 2030, significantly reduce the number of deaths and the number of people affected and substantially decrease the direct economic losses relative to global gross domestic product caused by disasters, including water-related disasters, with a focus on protecting the poor and people in vulnerable situations","Bis 2030 die Zahl der durch Katastrophen, einschließlich Wasserkatastrophen, bedingten Todesfälle und der davon betroffenen Menschen deutlich reduzieren und die dadurch verursachten unmittelbaren wirtschaftlichen Verluste im Verhältnis zum globalen Bruttoinlandsprodukt wesentlich verringern, mit Schwerpunkt auf dem Schutz der Armen und von Menschen in prekären Situationen"
global_targets:11-6-title,"By 2030, reduce the adverse per capita environmental impact of cities, including by paying special attention to air quality and municipal and other waste management","Bis 2030 die von den Städten ausgehende Umweltbelastung pro Kopf senken, unter anderem mit besonderer Aufmerksamkeit auf der Luftqualität und der kommunalen und sonstigen Abfallbehandlung"
global_targets:11-7-title,"By 2030, provide universal access to safe, inclusive and accessible, green and public spaces, in particular for women and children, older persons and persons with disabilities","Bis 2030 den allgemeinen Zugang zu sicheren, inklusiven und zugänglichen Grünflächen und öffentlichen Räumen gewährleisten, insbesondere für Frauen und Kinder, ältere Menschen und Menschen mit Behinderungen"
global_targets:11-a-title,"Support positive economic, social and environmental links between urban, peri-urban and rural areas by strengthening national and regional development planning","Durch eine verstärkte nationale und regionale Entwicklungsplanung positive wirtschaftliche, soziale und ökologische Verbindungen zwischen städtischen, stadtnahen und ländlichen Gebieten unterstützen"
global_targets:11-b-title,"By 2020, substantially increase the number of cities and human settlements adopting and implementing integrated policies and plans towards inclusion, resource efficiency, mitigation and adaptation to climate change, resilience to disasters, and develop and implement, in line with the Sendai Framework for Disaster Risk Reduction 2015–2030, holistic disaster risk management at all levels","Bis 2020 die Zahl der Städte und Siedlungen, die integrierte Politiken und Pläne zur Förderung der Inklusion, der Ressourceneffizienz, der Abschwächung des Klimawandels, der Klimaanpassung und der Widerstandsfähigkeit gegenüber Katastrophen beschließen und umsetzen, wesentlich erhöhen und gemäß dem Sendai-Rahmen für Katastrophenvorsorge 2015-2030 ein ganzheitliches Katastrophenrisikomanagement auf allen Ebenen entwickeln und umsetzen"
global_targets:11-c-title,"Support least developed countries, including through financial and technical assistance, in building sustainable and resilient buildings utilizing local materials",Die am wenigsten entwickelten Länder unter anderem durch finanzielle und technische Hilfe beim Bau nachhaltiger und widerstandsfähiger Gebäude unter Nutzung einheimischer Materialien unterstützen
global_targets:12-1-title,"Implement the 10‐Year Framework of Programmes on Sustainable Consumption and Production Patterns, all countries taking action, with developed countries taking the lead, taking into account the development and capabilities of developing countries","Den Zehnjahres-Programmrahmen für nachhaltige Konsum- und Produktionsmuster umsetzen, wobei alle Länder, an der Spitze die entwickelten Länder, Maßnahmen ergreifen, unter Berücksichtigung des Entwicklungsstands und der Kapazitäten der Entwicklungsländer"
global_targets:12-2-title,"By 2030, achieve the sustainable management and efficient use of natural resources",Bis 2030 die nachhaltige Bewirtschaftung und effiziente Nutzung der natürlichen Ressourcen erreichen
global_targets:12-3-title,"By 2030, halve per capita global food waste at the retail and consumer levels and reduce food losses along production and supply chains, including post-harvest losses",Bis 2030 die weltweite Nahrungsmittelverschwendung pro Kopf auf Einzelhandels und Verbraucherebene halbieren und die entlang der Produktions- und Lieferkette entstehenden Nahrungsmittelverluste einschließlich Nachernteverlusten verringern
global_targets:12-4-title,"By 2020, achieve the environmentally sound management of chemicals and all wastes throughout their life cycle, in accordance with agreed international frameworks, and significantly reduce their release to air, water and soil in order to minimize their adverse impacts on human health and the environment","Bis 2020 einen umweltverträglichen Umgang mit Chemikalien und allen Abfällen während ihres gesamten Lebenszyklus in Übereinstimmung mit den vereinbarten internationalen Rahmenregelungen erreichen und ihre Freisetzung in Luft, Wasser und Boden erheblich verringern, um ihre nachteiligen Auswirkungen auf die menschliche Gesundheit und die Umwelt auf ein Mindestmaß zu beschränken"
global_targets:12-5-title,"By 2030, substantially reduce waste generation through prevention, reduction, recycling and reuse","Bis 2030 das Abfallaufkommen durch Vermeidung, Verminderung, Wiederverwertung und Wiederverwendung deutlich verringern"
global_targets:12-6-title,"Encourage companies, especially large and transnational companies, to adopt sustainable practices and to integrate sustainability information into their reporting cycle","Die Unternehmen, insbesondere große und transnationale Unternehmen, dazu ermutigen, nachhaltige Verfahren einzuführen und in ihre Berichterstattung Nachhaltigkeitsinformationen aufzunehmen"
global_targets:12-7-title,"Promote public procurement practices that are sustainable, in accordance with national policies and priorities","In der öffentlichen Beschaffung nachhaltige Verfahren fördern, im Einklang mit den nationalen Politiken und Prioritäten"
global_targets:12-8-title,"By 2030, ensure that people everywhere have the relevant information and awareness for sustainable development and lifestyles in harmony with nature","Bis 2030 sicherstellen, dass die Menschen überall über einschlägige Informationen und das Bewusstsein für nachhaltige Entwicklung und eine Lebensweise in Harmonie mit der Natur verfügen"
global_targets:12-a-title,Support developing countries to strengthen their scientific and technological capacity to move towards more sustainable patterns of consumption and production,Die Entwicklungsländer bei der Stärkung ihrer wissenschaftlichen und technologischen Kapazitäten im Hinblick auf den Übergang zu nachhaltigeren Konsum- und Produktionsmustern unterstützen
global_targets:12-b-title,Develop and implement tools to monitor sustainable development impacts for sustainable tourism that creates jobs and promotes local culture and products,"Instrumente zur Beobachtung der Auswirkungen eines nachhaltigen Tourismus, der Arbeitsplätze schafft und die lokale Kultur und lokale Produkte fördert, auf die nachhaltige Entwicklung entwickeln und anwenden"
global_targets:12-c-title,"Rationalize inefficient fossil-fuel subsidies that encourage wasteful consumption by removing market distortions, in accordance with national circumstances, including by restructuring taxation and phasing out those harmful subsidies, where they exist, to reflect their environmental impacts, taking fully into account the specific needs and conditions of developing countries and minimizing the possible adverse impacts on their development in a manner that protects the poor and the affected communities","Die ineffiziente Subventionierung fossiler Brennstoffe, die zu verschwenderischem Verbrauch verleitet, durch Beseitigung von Marktverzerrungen entsprechend den nationalen Gegebenheiten rationalisieren, unter anderem durch eine Umstrukturierung der Besteuerung und die allmähliche Abschaffung dieser schädlichen Subventionen, um ihren Umweltauswirkungen Rechnung zu tragen, wobei die besonderen Bedürfnisse und Gegebenheiten der Entwicklungsländer in vollem Umfang berücksichtigt und die möglichen nachteiligen Auswirkungen auf ihre Entwicklung in einer die Armen und die betroffenen Gemeinwesen schützenden Weise so gering wie möglich gehalten werden"
global_targets:13-1-title,Strengthen resilience and adaptive capacity to climate-related hazards and natural disasters in all countries,Die Widerstandskraft und die Anpassungsfähigkeit gegenüber klimabedingten Gefahren und Naturkatastrophen in allen Ländern stärken
global_targets:13-2-title,"Integrate climate change measures into national policies, strategies and planning","Klimaschutzmaßnahmen in die nationalen Politiken, Strategien und Planungen einbeziehen"
global_targets:13-3-title,"Improve education, awareness-raising and human and institutional capacity on climate change mitigation, adaptation, impact reduction and early warning","Die Aufklärung und Sensibilisierung sowie die personellen und institutionellen Kapazitäten im Bereich der Abschwächung des Klimawandels, der Klimaanpassung, der Reduzierung der Klimaauswirkungen sowie der Frühwarnung verbessern"
global_targets:13-a-title,Implement the commitment undertaken by developed-country parties to the United Nations Framework Convention on Climate Change to a goal of mobilizing jointly $100 billion annually by 2020 from all sources to address the needs of developing countries in the context of meaningful mitigation actions and transparency on implementation and fully operationalize the Green Climate Fund through its capitalization as soon as possible,"Die Verpflichtung erfüllen, die von den Vertragsparteien des Rahmenübereinkommens der Vereinten Nationen über Klimaänderungen, die entwickelte Länder sind, übernommen wurde, bis 2020 gemeinsam jährlich 100 Milliarden Dollar aus allen Quellen aufzubringen, um den Bedürfnissen der Entwicklungsländer im Kontext sinnvoller Klimaschutzmaßnahmen und einer transparenten Umsetzung zu entsprechen, und den Grünen Klimafonds vollständig zu operationalisieren, indem er schnellstmöglich mit den erforderlichen Finanzmitteln ausgestattet wird"
global_targets:13-b-title,"Promote mechanisms for raising capacity for effective climate change-related planning and management in least developed countries and small island developing States, including focusing on women, youth and local and marginalized communities","Mechanismen zum Ausbau effektiver Planungs- und Managementkapazitäten im Bereich des Klimawandels in den am wenigsten entwickelten Ländern und kleinen Inselentwicklungsländern fördern, unter anderem mit gezielter Ausrichtung auf Frauen, junge Menschen sowie lokale und marginalisierte Gemeinwesen"
global_targets:14-1-title,"By 2025, prevent and significantly reduce marine pollution of all kinds, in particular from land-based activities, including marine debris and nutrient pollution","Bis 2025 alle Arten der Meeresverschmutzung, insbesondere durch vom Lande ausgehende Tätigkeiten und namentlich Meeresmüll und Nährstoffbelastung, verhüten und erheblich verringern"
global_targets:14-2-title,"By 2020, sustainably manage and protect marine and coastal ecosystems to avoid significant adverse impacts, including by strengthening their resilience, and take action for their restoration in order to achieve healthy and productive oceans","Bis 2020 die Meeres- und Küstenökosysteme nachhaltig bewirtschaften und schützen, um unter anderem durch Stärkung ihrer Resilienz erhebliche nachteilige Auswirkungen zu vermeiden, und Maßnahmen zu ihrer Wiederherstellung ergreifen, damit die Meere wieder gesund und produktiv werden"
global_targets:14-3-title,"Minimize and address the impacts of ocean acidification, including through enhanced scientific cooperation at all levels","Die Versauerung der Ozeane auf ein Mindestmaß reduzieren und ihre Auswirkungen bekämpfen, unter anderem durch eine verstärkte wissenschaftliche Zusammenarbeit auf allen Ebenen"
global_targets:14-4-title,"By 2020, effectively regulate harvesting and end overfishing, illegal, unreported and unregulated fishing and destructive fishing practices and implement science-based management plans, in order to restore fish stocks in the shortest time feasible, at least to levels that can produce maximum sustainable yield as determined by their biological characteristics","Bis 2020 die Fangtätigkeit wirksam regeln und die Überfischung, die illegale, ungemeldete und unregulierte Fischerei und zerstörerische Fangpraktiken beenden und wissenschaftlich fundierte Bewirtschaftungspläne umsetzen, um die Fischbestände in kürzestmöglicher Zeit mindestens auf einen Stand zurückzuführen, der den höchstmöglichen Dauerertrag unter Berücksichtigung ihrer biologischen Merkmale sichert"
global_targets:14-5-title,"By 2020, conserve at least 10 per cent of coastal and marine areas, consistent with national and international law and based on the best available scientific information",Bis 2020 mindestens 10 Prozent der Küsten- und Meeresgebiete im Einklang mit dem nationalen Recht und dem Völkerrecht und auf der Grundlage der besten verfügbaren wissenschaftlichen Informationen erhalten
global_targets:14-6-title,"By 2020, prohibit certain forms of fisheries subsidies which contribute to overcapacity and overfishing, eliminate subsidies that contribute to illegal, unreported and unregulated fishing and refrain from introducing new such subsidies, recognizing that appropriate and effective special and differential treatment for developing and least developed countries should be an integral part of the World Trade Organization fisheries subsidies negotiation","Bis 2020 bestimmte Formen der Fischereisubventionen untersagen, die zu Überkapazitäten und Überfischung beitragen, Subventionen abschaffen, die zu illegaler, ungemeldeter und unregulierter Fischerei beitragen, und keine neuen derartigen Subventionen einführen, in Anerkennung dessen, dass eine geeignete und wirksame besondere und differenzierte Behandlung der Entwicklungsländer und der am wenigsten entwickelten Länder einen untrennbaren Bestandteil der im Rahmen der Welthandelsorganisation geführten Verhandlungen über Fischereisubventionen bilden sollte"
global_targets:14-7-title,"By 2030, increase the economic benefits to small island developing States and least developed countries from the sustainable use of marine resources, including through sustainable management of fisheries, aquaculture and tourism","Bis 2030 die sich aus der nachhaltigen Nutzung der Meeresressourcen ergebenden wirtschaftlichen Vorteile für die kleinen Inselentwicklungsländer und die am wenigsten entwickelten Länder erhöhen, namentlich durch nachhaltiges Management der Fischerei, der Aquakultur und des Tourismus"
global_targets:14-a-title,"Increase scientific knowledge, develop research capacity and transfer marine technology, taking into account the Intergovernmental Oceanographic Commission Criteria and Guidelines on the Transfer of Marine Technology, in order to improve ocean health and to enhance the contribution of marine biodiversity to the development of developing countries, in particular small island developing States and least developed countries","Die wissenschaftlichen Kenntnisse vertiefen, die Forschungskapazitäten ausbauen und Meerestechnologien weitergeben, unter Berücksichtigung der Kriterien und Leitlinien der Zwischenstaatlichen Ozeanographischen Kommission für die Weitergabe von Meerestechnologie, um die Gesundheit der Ozeane zu verbessern und den Beitrag der biologischen Vielfalt der Meere zur Entwicklung der Entwicklungsländer, insbesondere der kleinen Inselentwicklungsländer und der am wenigsten entwickelten Länder, zu verstärken"
global_targets:14-b-title,Provide access for small-scale artisanal fishers to marine resources and markets,Den Zugang der handwerklichen Kleinfischer zu den Meeresressourcen und Märkten gewährleisten
